<?xml version="1.0" encoding="UTF-8"?>
<xs:schema xmlns:xs="http://www.w3.org/2001/XMLSchema">
    <xs:element name="inmobiliaria">
        <xs:complexType>
            <xs:sequence>
                <xs:element name="agencias">
                    <xs:complexType>
                        <xs:sequence>
                            <xs:element name="agencia">
                                <xs:complexType>
                                    <xs:sequence>
                                        <xs:element name="correo_electronico" type="xs:string" />
                                        <xs:element name="nombre" type="xs:string" />
                                        <xs:element name="telefono" type="xs:string" />
                                    </xs:sequence>
                                    <xs:attribute name="id" type="xs:integer" use="required" />
                                </xs:complexType>
                            </xs:element>
                        </xs:sequence>
                    </xs:complexType>
                </xs:element>
                <xs:element name="propietarios">
                    <xs:complexType>
                        <xs:sequence>
                            <xs:element name="propietario">
                                <xs:complexType>
                                    <xs:sequence>
                                        <xs:element name="nombre" type="xs:string" />
                                    </xs:sequence>
                                    <xs:attribute name="id" type="xs:integer" use="required" />
                                </xs:complexType>
                            </xs:element>
                        </xs:sequence>
                    </xs:complexType>
                </xs:element>
                <xs:element name="propiedades">
                    <xs:complexType>
                        <xs:sequence>
                            <xs:element name="propiedad">
                                <xs:complexType>
                                    <xs:sequence>
                                        <xs:element name="nombre" type="xs:string" />
                                        <xs:element name="num_pisos"  >
                                            <xs:simpleType>
                                                <xs:restriction base="xs:positiveInteger">
                                                    <xs:minInclusive value="150"/>

                                                </xs:restriction>
                                            </xs:simpleType>
                                        </xs:element>
                                        <xs:element name="propietario_perteneciente">
                                            <xs:complexType>
                                                <xs:sequence>
                                                    <xs:element name="id" type="xs:string" />
                                                    <xs:element name="nombre" type="xs:string" />
                                                </xs:sequence>
                                            </xs:complexType>
                                        </xs:element>
                                    </xs:sequence>
                                    <xs:attribute name="id" type="xs:integer" use="required" />
                                </xs:complexType>
                            </xs:element>
                        </xs:sequence>
                    </xs:complexType>
                </xs:element>
                <xs:element name="pisos">
                    <xs:complexType>
                        <xs:sequence>
                            <xs:element name="piso">
                                <xs:complexType>
                                    <xs:sequence>
                                        <xs:element name="nombre" type="xs:string" />
                                        <xs:element name="descripcion" type="xs:string" />
                                        <xs:element name="precio">
                                            <xs:simpleType>
                                                <xs:restriction base="xs:integer">
                                                    <xs:minInclusive value="0"/>
                                                </xs:restriction>
                                            </xs:simpleType>
                                        </xs:element>

                                        <xs:element name="fecha_alta" type="xs:string" />
                                        <xs:element name="calidad">
                                                    <xs:simpleType>
                                                        <xs:restriction base="xs:string">
                                                            <xs:enumeration value="A"/>
                                                            <xs:enumeration value="B"/>
                                                            <xs:enumeration value="C"/>
                                                            <xs:enumeration value="D"/>
                                                            <xs:enumeration value="E"/>
                                                            <xs:enumeration value="F"/>

                                                        </xs:restriction>
                                                    </xs:simpleType>
                                        </xs:element>
                                        <xs:element name="propiedad_perteneciente">
                                            <xs:complexType>
                                                <xs:sequence>
                                                    <xs:element name="id" type="xs:string" />
                                                    <xs:element name="nombre" type="xs:string" />
                                                </xs:sequence>
                                            </xs:complexType>
                                        </xs:element>
                                    </xs:sequence>
                                    <xs:attribute name="id" use="required" >
                                        <xs:simpleType>
                                            <xs:restriction base="xs:string">
                                                <xs:pattern value="[fF][0-9]{1,5}"></xs:pattern>

                                            </xs:restriction>
                                        </xs:simpleType>
                                        </xs:attribute>


                                </xs:complexType>
                            </xs:element>
                        </xs:sequence>
                    </xs:complexType>
                </xs:element>
            </xs:sequence>
        </xs:complexType>
    </xs:element>
</xs:schema>